{
  "title": "On the coherency of quantitative evaluation of visual explanations",
  "date": "2024/04/01",
  "link": "https://doi.org/10.1016/j.cviu.2024.103934",
  "conference": "CVIU vol. 241",
  "tags": [],
  "image": "benjamin.jpg",
  "description": "Measuring the correlation between different quantitative evaluation metrics for visual explanations."
}
