{
  "title": "Finding manifolds with bilinear autoencoders",
  "date": "2025/10/01",
  "conference": "NeurIPS'25",
  "tags": ["spotlight", "workshop"],
  "link": "https://www.arxiv.org/pdf/2510.16820",
  "image": "thomas.jpg",
  "description": "Decomposing activations into sparse polynomials and using their geometry"
}
