{
  "title": "Explaining and interpreting hyperdimensional computing classifiers on tabular data",
  "date": "2025/10/01",
  "conference": "Neurocomputing",
  "tags": [],
  "link": "https://doi.org/10.1016/j.neucom.2025.131643",
  "image": "jose.png",
  "description": "We make HDC classifiers for tabular data more interpretable"
}
