{
  "title": "Recognizing actions in high-resolution low-framerate videos: a feasibility study in the construction sector",
  "date": "2024/02/27",
  "link": "https://repository.uantwerpen.be/docman/irua/3d6ebamotoMe4",
  "conference": "VISAPP'24",
  "tags": [],
  "image": "benjamin.jpg",
  "description": "This study investigates the applicability of established action recognition methodologies in the dynamic setting of the construction sector."
}
