{
  "title": "Deep learning model compression for resource efficient activity recognition on edge devices: a case study",
  "date": "2024/02/27",
  "link": "https://repository.uantwerpen.be/docman/irua/666490motoM98",
  "conference": "VISAPP'24",
  "tags": [],
  "image": "benjamin.jpg",
  "description": "This paper presents an approach to adapt an existing activity recognition model for efficient deployment on edge devices."
}
