{
  "title": "Gated Recurrent Unit with Multilingual Universal Sentence Encoder for Arabic Aspect-Based Sentiment Analysis",
  "date": "2023/02/01",
  "conference": "Knowledge Based Systems",
  "tags": [],
  "link": "https://www.sciencedirect.com/science/article/pii/S0950705122007300",
  "image": "saja.png",
  "description": "This study presents a deep learning model for Arabic Aspect-Based Sentiment Analysis (ABSA) using Gated Recurrent Units (GRU) combined with features from the Multilingual Universal Sentence Encoder (MUSE)"
}
